{
"$schema": "https://json-schema.org/draft/2020-12/schema",
"$id": "https://q2t-project.github.io/3dsl/schemas/3DSS.schema.json#v1.0.0",
"title": "3DSS Schema v1.0.0",
"type": "object",
"properties": {
  "lines": [],
  "points": [],
  "aux": [],
  "document_meta": {
    "document_uuid": "c2881606-0bc4-4f0f-ada3-e3d0c3f4e089",
    "schema_uri": "https://q2t-project.github.io/3dsl/schemas/3DSS.schema.json#v1.0.0",
    "author": "creator@example.com",
    "version": "1.0.0"
  }
}
}