{
  "document_meta": {
    "document_title": "Regression fixture: center visible",
    "document_summary": "Regression fixture for viewer runtime regression suite.",
    "document_uuid": "aaaaaaaa-aaaa-4aaa-8aaa-aaaaaaaaaaaa",
    "schema_uri": "https://q2t-project.github.io/3dsl/schemas/3DSS.schema.json#v1.1.3",
    "author": "regression",
    "version": "1.1.0",
    "coordinate_system": "Z+up/freeXY",
    "units": "non_si:px"
  },
  "points": [
    {
      "meta": {
        "uuid": "11111111-1111-4111-8111-111111111111",
        "tags": [
          "s:regression",
          "s:center",
          "s:visible"
        ]
      },
      "appearance": {
        "position": [
          0,
          0,
          0
        ],
        "marker": {
          "primitive": "sphere",
          "radius": 0.4
        },
        "visible": true,
        "frames": [
          0
        ]
      }
    },
    {
      "meta": {
        "uuid": "22222222-2222-4222-8222-222222222222",
        "tags": [
          "s:regression",
          "s:invisible"
        ]
      },
      "appearance": {
        "position": [
          2,
          0,
          0
        ],
        "marker": {
          "primitive": "box",
          "size": [
            0.6,
            0.6,
            0.6
          ]
        },
        "visible": false,
        "frames": [
          0
        ]
      }
    }
  ],
  "lines": [
    {
      "meta": {
        "uuid": "bbbbbbbb-bbbb-4bbb-8bbb-bbbbbbbbbbbb",
        "tags": [
          "s:regression",
          "s:line"
        ]
      },
      "appearance": {
        "end_a": {
          "ref": "11111111-1111-4111-8111-111111111111"
        },
        "end_b": {
          "ref": "22222222-2222-4222-8222-222222222222"
        },
        "line_type": "straight",
        "visible": true,
        "frames": [
          0
        ]
      }
    }
  ],
  "aux": [
    {
      "meta": {
        "uuid": "cccccccc-cccc-4ccc-8ccc-cccccccccccc",
        "tags": [
          "s:regression",
          "s:grid"
        ]
      },
      "appearance": {
        "module": {
          "grid": {
            "grid_type": "cartesian",
            "subdivisions": 8,
            "major_step": 4,
            "minor_step": 1
          }
        },
        "visible": true,
        "frames": [
          0
        ]
      }
    }
  ]
}
