{
  "document_meta": {
    "document_title": "Regression valid: only invisible center",
    "document_summary": "Pick guard: center is invisible, no other geometry overlaps.",
    "document_uuid": "22222222-2222-4222-8222-222222222222",
    "schema_uri": "https://3dsl.jp/schemas/release/v1.1.4/3DSS.schema.json#v1.1.4",
    "author": "regression",
    "version": "1.0.0",
    "coordinate_system": "Z+up/freeXY",
    "units": "non_si:px",
    "generator": "https://3dsl.jp/"
  },
  "points": [
    {
      "meta": {
        "uuid": "11111111-1111-4111-8111-111111111111",
        "tags": [
          "s:regression",
          "s:center"
        ]
      },
      "appearance": {
        "position": [
          0,
          0,
          0
        ],
        "marker": {
          "primitive": "sphere",
          "radius": 0.4
        },
        "visible": false
      }
    }
  ],
  "lines": [],
  "aux": []
}

