{
    "lines": [
    {
      "meta": { "uuid": "L1" },
      "appearance": {
        "end_a": { "ref": "P1" },
        "end_b": { "ref": "P2" },
        "color": "#55aaff",
        "line_type": "straight"
      }
    }
  ],
  "points": [
    {
      "meta": { "uuid": "P1" },
      "appearance": { "position": [0,0,0], "color": "#ff5555" }
    },
    {
      "meta": { "uuid": "P2" },
      "appearance": { "position": [1,0,0], "color": "#55ff55" }
    }
  ],
  "aux": [],
  "document_meta": {
    "document_uuid": "00000000-0000-0000-0000-000000000001",
    "schema_uri": "https://q2t-project.github.io/3dsl/schemas/3DSS.schema.json#v1.0.1",
    "author": "dev",
    "version": "1.0.1"
  }
}
