{
  "lines": [],
  "points": [],
  "aux": [],
  "document_meta": {
    "document_uuid": "5f6180cf-8c15-4e87-bd3f-7f640ec8f991",
    "schema_uri": "https://q2t-project.github.io/3dsl/schemas/3DSS.schema.json#v1.0.0",
    "author": "samples@3dsl.test",
    "version": "1.0.0",
    "tags": ["s:smoke"],
    "coordinate_system": "Z+up/freeXY",
    "units": "mm"
  }
}
