{
  "document_meta": {
    "document_title": "3DSS Default Scene",
    "document_summary": "Viewer fallback default sample (v1.1.3). Minimal primitives + text + lines.",
    "document_uuid": "7f3b2d2a-7a1c-4c84-9b3a-7e3c42f0f9c1",
    "version": "1.0.1",
    "updated_at": "2026-01-19T00:00:00Z",
    "tags": [
      "s:3dsl",
      "s:sample",
      "m:default"
    ],
    "schema_uri": "https://q2t-project.github.io/3dsl/schemas/release/v1.1.3/3DSS.schema.json#v1.1.3",
    "generator": "https://q2t-project.github.io/3dsl/",
    "reference": "default scene",
    "coordinate_system": "Z+up/freeXY",
    "units": "non_si:px",
    "i18n": "ja",
    "author": "q2t-project",
    "creator_memo": "Stable minimal default sample. Keep small + deterministic."
  },
  "points": [
    {
      "signification": {
        "name": "Hello 3DSL"
      },
      "appearance": {
        "position": [
          0,
          0,
          0
        ],
        "marker": {
          "primitive": "sphere",
          "radius": 0.25,
          "common": {
            "opacity": 0.2,
            "emissive": false,
            "wireframe": false,
            "color": "#ff0000"
          },
          "text": {
            "content": "Hello 3DSL",
            "pose": {
              "front": [ 
                0,
                1,
                0
              ],
              "up": [ 
                0,
                0,
                1
              ]
            },
            "size": 16,
            "align": "center&middle",
            "font": "helvetiker_regular"
          }
        }
      },
      "meta": {
        "uuid": "11111111-1111-4111-8111-111111111111",
        "tags": [
          "x:root"
        ],
        "creator_memo": "Root point"
      }
    },
    {
      "signification": {
        "name": "Point A"
      },
      "appearance": {
        "position": [
          -4,
          8,
          0
        ],
        "marker": {
          "primitive": "sphere",
          "radius": 0.5,
          "common": {
            "opacity": 0.15,
            "emissive": false,
            "wireframe": false,
            "color": "#880088"
          },
          "text": {
            "content": "relations",
            "pose": {
              "front": [
                1,
                0,
                0
              ],
              "up": [
                0,
                0,
                1
              ]
            },
            "size": 8,
            "align": "left&baseline",
            "font": "helvetiker_regular"
          }
        }
      },
      "meta": {
        "uuid": "22222222-2222-4222-8222-222222222222",
        "tags": [
          "x:a"
        ]
      }
    },
    {
      "signification": {
        "name": "Point B"
      },
      "appearance": {
        "position": [
          12,
          8,
          0
        ],
        "marker": {
          "primitive": "box",
          "size": [
            1,
            2,
            0.25
          ],
          "common": {
            "opacity": 0.45,
            "emissive": false,
            "wireframe": false,
            "color": "#008888"
          },
          "text": {
            "content": "structure",
            "pose": {
              "front": [
                0,
                0,
                1
              ],
              "up": [
                0,
                1,
                0
              ]
            },
            "size": 8,
            "align": "center&middle",
            "font": "helvetiker_regular"
          }
        }
      },
      "meta": {
        "uuid": "33333333-3333-4333-8333-333333333333",
        "tags": [
          "x:b"
        ]
      }
    }
  ],
  "lines": [
    {
      "signification": {
        "relation": {
          "structural": "containment"
        },
        "sense": "a_to_b",
        "caption": ""
      },
      "appearance": {
        "end_a": {
          "ref": "11111111-1111-4111-8111-111111111111"
        },
        "end_b": {
          "ref": "22222222-2222-4222-8222-222222222222"
        },
        "line_style": "solid",
        "opacity": 0.45,
        "color": "#ffffff",
        "caption_text": {
          "pose": {
            "front": [
              1,
              0,
              0
            ],
            "up": [
              0,
              0,
              1
            ]
          },
          "font_size": 9
        },
        "line_type": "straight",
        "frames": [
          0
        ]
      },
      "meta": {
        "uuid": "aaaaaaa1-aaaa-4aaa-8aaa-aaaaaaaaaaa1",
        "tags": [
          "x:l_root_a"
        ]
      }
    },
    {
      "signification": {
        "relation": {
          "structural": "containment"
        },
        "sense": "a_to_b",
        "caption": ""
      },
      "appearance": {
        "end_a": {
          "ref": "11111111-1111-4111-8111-111111111111"
        },
        "end_b": {
          "ref": "33333333-3333-4333-8333-333333333333"
        },
        "line_style": "solid",
        "opacity": 0.15,
        "color": "#ff0000",
        "caption_text": {
          "pose": {
            "front": [
              1,
              0,
              0
            ],
            "up": [
              0,
              0,
              1
            ]
          },
          "font_size": 9
        },
        "line_type": "straight",
        "frames": [
          0
        ]
      },
      "meta": {
        "uuid": "aaaaaaa1-aaaa-4aaa-8aaa-aaaaaaaaaaa1",
        "tags": [
          "x:l_root_a"
        ]
      }
    },
    {
      "signification": {
        "relation": {
          "structural": "association"
        },
        "sense": "a_to_b",
        "caption": "A â†’ B"
      },
      "appearance": {
        "end_a": {
          "ref": "22222222-2222-4222-8222-222222222222"
        },
        "end_b": {
          "ref": "33333333-3333-4333-8333-333333333333"
        },
        "line_style": "solid",
        "opacity": 0.45,
        "color": "#ffffff",
        "caption_text": {
          "pose": {
            "front": [
              0,
              1,
              1
            ],
            "up": [
              1,
              0,
              0
            ]
          },
          "font_size": 10
        },
        "line_type": "straight",
        "frames": [
          0
        ]
      },
      "meta": {
        "uuid": "aaaaaaa2-aaaa-4aaa-8aaa-aaaaaaaaaaa2",
        "tags": [
          "x:l_a_b"
        ]
      }
    }
  ],
  "aux": []
}
