{
  "lines": [
    {
      "signification": {
        "relation": {
          "structural": "association"
        },
        "sense": "a_to_b"
      },
      "appearance": {
        "end_a": {
          "ref": "c52555fc-1703-41c5-9dcb-f178bbe38b24"
        },
        "end_b": {
          "ref": "c57e5c82-6936-4cf2-944e-b3533db3209c"
        },
        "line_type": "straight",
        "line_style": "solid",
        "color": "#ffffff",
        "opacity": 1.0,
        "frames": [1, 2]
      },
      "meta": {
        "uuid": "92a544b4-4f1d-4f4a-b6ba-40ae83a2a998"
      }
    },
    {
      "signification": {
        "relation": {
          "structural": "association"
        },
        "sense": "a_to_b"
      },
      "appearance": {
        "end_a": {
          "ref": "c57e5c82-6936-4cf2-944e-b3533db3209c"
        },
        "end_b": {
          "ref": "2037640e-bd5f-4fed-a050-e759cee6c3d5"
        },
        "line_type": "straight",
        "line_style": "dashed",
        "color": "#ffaa00",
        "opacity": 0.9,
        "frames": 2
      },
      "meta": {
        "uuid": "a3be4b39-f542-4b5a-861b-f2b44aeb677c"
      }
    },
    {
      "signification": {
        "relation": {
          "structural": "association"
        },
        "sense": "a_to_b"
      },
      "appearance": {
        "end_a": {
          "ref": "2037640e-bd5f-4fed-a050-e759cee6c3d5"
        },
        "end_b": {
          "ref": "c52555fc-1703-41c5-9dcb-f178bbe38b24"
        },
        "line_type": "straight",
        "line_style": "solid",
        "color": "#8888ff",
        "opacity": 0.7,
        "frames": 2
      },
      "meta": {
        "uuid": "6ebd3014-004c-4078-8c03-1cb82b54d0d4"
      }
    }
  ],
  "points": [
    {
      "signification": {
        "name": "P0@frame0-2"
      },
      "appearance": {
        "position": [-1.0, 0.0, 0.0],
        "marker": {
          "common": {
            "color": "#ff5555",
            "opacity": 1.0
          }
        },
        "frames": [0, 1, 2]
      },
      "meta": {
        "uuid": "c52555fc-1703-41c5-9dcb-f178bbe38b24"
      }
    },
    {
      "signification": {
        "name": "P1@frame1-2"
      },
      "appearance": {
        "position": [1.0, 0.0, 0.0],
        "marker": {
          "common": {
            "color": "#55ff55",
            "opacity": 1.0
          }
        },
        "frames": [1, 2]
      },
      "meta": {
        "uuid": "c57e5c82-6936-4cf2-944e-b3533db3209c"
      }
    },
    {
      "signification": {
        "name": "P2@frame2"
      },
      "appearance": {
        "position": [0.0, 1.2, 0.0],
        "marker": {
          "common": {
            "color": "#5555ff",
            "opacity": 1.0
          }
        },
        "frames": 2
      },
      "meta": {
        "uuid": "2037640e-bd5f-4fed-a050-e759cee6c3d5"
      }
    }
  ],
  "aux": [
    {
      "appearance": {
        "position": [0.0, 0.0, 0.0],
        "orientation": [0.0, 0.0, 0.0],
        "opacity": 0.4,
        "module": {
          "grid": {
            "grid_type": "cartesian",
            "subdivisions": 1,
            "major_step": 2,
            "minor_step": 1,
            "color_major": "#666666",
            "color_minor": "#333333"
          },
          "axis": {
            "length": 8,
            "labels": true,
            "arrow": {
              "enabled": true,
              "size": 2,
              "aspect": 2
            }
          },
          "plate": {
            "plane": "zx",
            "position": [0, 0, 0],
            "size": [4, 8],
            "reflectivity": 0.5,
            "opacity": 0.5
          }
        }
      },
      "meta": {
        "uuid": "aaaaaaaa-1111-4111-8111-aaaaaaaaaaaa"
      }
    }
  ],
  "document_meta": {
    "document_uuid": "ff92f809-c7b1-4d28-8da0-83f049b45051",
    "schema_uri": "https://q2t-project.github.io/3dsl/schemas/3DSS.schema.json#v1.0.1",
    "author": "3dsl-frame-test",
    "version": "1.0.0",
    "coordinate_system": "Z+up/freeXY",
    "units": "mm",
    "i18n": "ja",
    "creator_memo": "frame=0/1/2 で points / lines が段階的に増えるテスト用 3DSS（v1.0.1 準拠 / marker.common.color へ統一済み）。"
  }
}
