{
  "document_meta": {
    "document_title": "26012002",
    "document_summary": "",
    "document_uuid": "c47d0d6c-9f02-43e7-ac86-ebcc735b0446",
    "schema_uri": "https://q2t-project.github.io/3dsl/schemas/3DSS.schema.json#v1.1.3",
    "author": "vrrrm",
    "version": "1.0.0"
  },
  "points": [],
  "lines": [],
  "aux": []
}
