{
  "document_meta": {
    "document_uuid": "78699f09-7ae6-4287-a7db-0b7dad27915e",
    "version": "1.0.1",
    "updated_at": "2025-12-01T00:00:00Z",
    "schema_uri": "https://q2t-project.github.io/3dsl/schemas/3DSS.schema.json#v1.0.1",
    "author": "demo@3dsl",
    "coordinate_system": "Z+up/freeXY",
    "units": "mm",
    "i18n": "ja",
    "tags": [
      "s:demo",
      "m:arrow",
      "x:viewer-test"
    ],
    "generator": "https://q2t-project.github.io/3dsl/",
    "reference": "Arrow test sample",
    "creator_memo": "3DSS sample for testing lines with arrows and endpoint trimming."
  },
  "points": [
    {
      "meta": {
        "uuid": "9f3062d6-4b9a-462c-8366-a612df98a766",
        "tags": [
          "s:point-a"
        ]
      },
      "signification": {
        "name": {
          "ja": "Point A",
          "en": "Point A"
        }
      },
      "appearance": {
        "position": [
          0,
          0,
          0
        ],
        "marker": {
          "shape": "sphere",
          "common": {
            "scale": [
              1.2,
              1.2,
              1.2
            ],
            "color": "#66ccff",
            "opacity": 0.8,
            "emissive": false,
            "wireframe": false
          },
          "text": {
            "content": "A",
            "font": "helvetiker_regular",
            "size": 8,
            "align": "center middle",
            "plane": "billboard"
          }
        },
        "visible": true
      }
    },
    {
      "meta": {
        "uuid": "a9172958-38c0-4dc4-baa0-dff239043d41",
        "tags": [
          "s:point-b"
        ]
      },
      "signification": {
        "name": {
          "ja": "Point B",
          "en": "Point B"
        }
      },
      "appearance": {
        "position": [
          1,
          0,
          0
        ],
        "marker": {
          "shape": "sphere",
          "common": {
            "scale": [
              1.2,
              1.2,
              1.2
            ],
            "color": "#66ccff",
            "opacity": 0.8,
            "emissive": false,
            "wireframe": false
          },
          "text": {
            "content": "B",
            "font": "helvetiker_regular",
            "size": 8,
            "align": "center middle",
            "plane": "billboard"
          }
        },
        "visible": true
      }
    },
    {
      "meta": {
        "uuid": "1d39a844-00d1-4585-a9c7-39305fe32e39",
        "tags": [
          "s:point-c"
        ]
      },
      "signification": {
        "name": {
          "ja": "Point C (above)",
          "en": "Point C (above)"
        }
      },
      "appearance": {
        "position": [
          0,
          1,
          0
        ],
        "marker": {
          "shape": "sphere",
          "common": {
            "scale": [
              1.2,
              1.2,
              1.2
            ],
            "color": "#66ccff",
            "opacity": 0.8,
            "emissive": false,
            "wireframe": false
          },
          "text": {
            "content": "C",
            "font": "helvetiker_regular",
            "size": 8,
            "align": "center middle",
            "plane": "billboard"
          }
        },
        "visible": true
      }
    },
    {
      "meta": {
        "uuid": "51cf3db4-2c43-4b3a-82c0-496fb85b083c",
        "tags": [
          "s:point-d"
        ]
      },
      "signification": {
        "name": {
          "ja": "Point D (far)",
          "en": "Point D (far)"
        }
      },
      "appearance": {
        "position": [
          1.5,
          1,
          0
        ],
        "marker": {
          "shape": "sphere",
          "common": {
            "scale": [
              1.2,
              1.2,
              1.2
            ],
            "color": "#66ccff",
            "opacity": 0.8,
            "emissive": false,
            "wireframe": false
          },
          "text": {
            "content": "D",
            "font": "helvetiker_regular",
            "size": 8,
            "align": "center middle",
            "plane": "billboard"
          }
        },
        "visible": true
      }
    }
  ],
  "lines": [
    {
      "meta": {
        "uuid": "4c521113-9d17-4ab4-a4fa-bed824f2f120",
        "tags": [
          "s:line-a-b",
          "m:arrow-sense"
        ]
      },
      "signification": {
        "relation": {
          "structural": "association"
        },
        "sense": "a_to_b"
      },
      "appearance": {
        "end_a": {
          "ref": "9f3062d6-4b9a-462c-8366-a612df98a766"
        },
        "end_b": {
          "ref": "a9172958-38c0-4dc4-baa0-dff239043d41"
        },
        "line_type": "straight",
        "line_style": {
          "width": 1.5,
          "pattern": "solid"
        },
        "color": "#ff9933",
        "opacity": 1.0,
        "arrow": {
          "shape": "cone",
          "auto_orient": true
        },
        "visible": true
      }
    },
    {
      "meta": {
        "uuid": "b6d8a088-4305-40ff-9515-2a09dbea6094",
        "tags": [
          "s:line-b-a",
          "m:arrow-sense"
        ]
      },
      "signification": {
        "relation": {
          "structural": "association"
        },
        "sense": "b_to_a"
      },
      "appearance": {
        "end_a": {
          "ref": "9f3062d6-4b9a-462c-8366-a612df98a766"
        },
        "end_b": {
          "ref": "a9172958-38c0-4dc4-baa0-dff239043d41"
        },
        "line_type": "straight",
        "line_style": {
          "width": 1.5,
          "pattern": "dashed"
        },
        "color": "#33cc66",
        "opacity": 1.0,
        "arrow": {
          "shape": "cone",
          "auto_orient": true
        },
        "visible": true
      }
    },
    {
      "meta": {
        "uuid": "5b79b4a1-397c-4a40-bd75-fbf902efcf2c",
        "tags": [
          "s:line-a-c",
          "m:arrow-bidirectional"
        ]
      },
      "signification": {
        "relation": {
          "structural": "association"
        },
        "sense": "bidirectional"
      },
      "appearance": {
        "end_a": {
          "ref": "9f3062d6-4b9a-462c-8366-a612df98a766"
        },
        "end_b": {
          "ref": "1d39a844-00d1-4585-a9c7-39305fe32e39"
        },
        "line_type": "straight",
        "line_style": {
          "width": 1.2,
          "pattern": "solid"
        },
        "color": "#ff66aa",
        "opacity": 0.9,
        "arrow": {
          "shape": "cone",
          "size": 0.1,
          "aspect": 2.0,
          "auto_orient": true
        },
        "visible": true
      }
    },
    {
      "meta": {
        "uuid": "df9f29f1-086c-4e9e-9a3e-5a358058c1eb",
        "tags": [
          "s:line-c-d",
          "m:arrow-placement-override"
        ]
      },
      "signification": {
        "relation": {
          "structural": "association"
        },
        "sense": "a_to_b"
      },
      "appearance": {
        "end_a": {
          "ref": "1d39a844-00d1-4585-a9c7-39305fe32e39"
        },
        "end_b": {
          "ref": "51cf3db4-2c43-4b3a-82c0-496fb85b083c"
        },
        "line_type": "straight",
        "line_style": {
          "width": 1.0,
          "pattern": "solid"
        },
        "color": "#9999ff",
        "opacity": 0.9,
        "arrow": {
          "shape": "cone",
          "size": 0.1,
          "aspect": 4,
          "placement": "end_a",
          "auto_orient": true
        },
        "visible": true
      }
    },
    {
      "meta": {
        "uuid": "773ec17f-e79d-4b34-995c-3f40a3e75718",
        "tags": [
          "s:line-coord",
          "m:arrow-coord-endpoints"
        ]
      },
      "signification": {
        "relation": {
          "structural": "association"
        },
        "sense": "neutral"
      },
      "appearance": {
        "end_a": {
          "coord": [
            -0.5,
            -0.5,
            0
          ]
        },
        "end_b": {
          "coord": [
            0.5,
            -0.5,
            0
          ]
        },
        "line_type": "straight",
        "line_style": {
          "width": 1.0,
          "pattern": "dotted"
        },
        "color": "#ffffff",
        "opacity": 0.7,
        "arrow": {
          "shape": "cone",
          "size": 0.2,
          "aspect": 6,
          "placement": "both",
          "auto_orient": true
        },
        "visible": true
      }
    }
  ],
  "aux": []
}
