{
  "lines": [
    { "meta": { "uuid": "L_D1_D2" }, "appearance": { "end_a": { "ref": "D1" }, "end_b": { "ref": "D2" }, "color": "#88ccff", "line_type": "straight" } },
    { "meta": { "uuid": "L_D2_D3" }, "appearance": { "end_a": { "ref": "D2" }, "end_b": { "ref": "D3" }, "color": "#88ccff", "line_type": "straight" } },
    { "meta": { "uuid": "L_D3_D4" }, "appearance": { "end_a": { "ref": "D3" }, "end_b": { "ref": "D4" }, "color": "#88ccff", "line_type": "straight" } },
    { "meta": { "uuid": "L_D4_D5" }, "appearance": { "end_a": { "ref": "D4" }, "end_b": { "ref": "D5" }, "color": "#88ccff", "line_type": "straight" } },

    { "meta": { "uuid": "L_D2_E1" }, "appearance": { "end_a": { "ref": "D2" }, "end_b": { "ref": "E1" }, "color": "#ffaa55", "line_type": "straight" } },
    { "meta": { "uuid": "L_D4_E2" }, "appearance": { "end_a": { "ref": "D4" }, "end_b": { "ref": "E2" }, "color": "#ffaa55", "line_type": "straight" } }
  ],
  "points": [
    { "meta": { "uuid": "D1" }, "appearance": { "position": [0.0, -1.0, -2.0], "color": "#55ff55" } },
    { "meta": { "uuid": "D2" }, "appearance": { "position": [0.0, -0.5, -1.0], "color": "#55ff55" } },
    { "meta": { "uuid": "D3" }, "appearance": { "position": [0.0, 0.0, 0.0], "color": "#55ff55" } },
    { "meta": { "uuid": "D4" }, "appearance": { "position": [0.0, 0.5, 1.0], "color": "#55ff55" } },
    { "meta": { "uuid": "D5" }, "appearance": { "position": [0.0, 1.0, 2.0], "color": "#55ff55" } },

    { "meta": { "uuid": "E1" }, "appearance": { "position": [1.0, 0.0, -1.0], "color": "#5599ff" } },
    { "meta": { "uuid": "E2" }, "appearance": { "position": [-1.0, 0.0, 1.0], "color": "#5599ff" } }
  ],
  "aux": [],
  "document_meta": {
    "document_uuid": "00000000-0000-0000-0000-000000000004",
    "schema_uri": "https://q2t-project.github.io/3dsl/schemas/3DSS.schema.json#v1.0.1",
    "author": "dev",
    "version": "1.0.1"
  }
}
