{
  "lines": [
    { "meta": { "uuid": "L_N1_N2" }, "appearance": { "end_a": { "ref": "N1" }, "end_b": { "ref": "N2" }, "color": "#88ccff", "line_type": "straight" } },
    { "meta": { "uuid": "L_N1_N3" }, "appearance": { "end_a": { "ref": "N1" }, "end_b": { "ref": "N3" }, "color": "#88ccff", "line_type": "straight" } },
    { "meta": { "uuid": "L_N2_N3" }, "appearance": { "end_a": { "ref": "N2" }, "end_b": { "ref": "N3" }, "color": "#88ccff", "line_type": "straight" } },

    { "meta": { "uuid": "L_F1_F2" }, "appearance": { "end_a": { "ref": "F1" }, "end_b": { "ref": "F2" }, "color": "#ffaa55", "line_type": "straight" } },
    { "meta": { "uuid": "L_F1_F3" }, "appearance": { "end_a": { "ref": "F1" }, "end_b": { "ref": "F3" }, "color": "#ffaa55", "line_type": "straight" } },

    { "meta": { "uuid": "L_N1_F1" }, "appearance": { "end_a": { "ref": "N1" }, "end_b": { "ref": "F1" }, "color": "#ffffff", "line_type": "straight" } }
  ],
  "points": [
    { "meta": { "uuid": "N1" }, "appearance": { "position": [0.0, 0.0, 0.0], "color": "#55ff55" } },
    { "meta": { "uuid": "N2" }, "appearance": { "position": [0.5, 0.2, 0.1], "color": "#55ff55" } },
    { "meta": { "uuid": "N3" }, "appearance": { "position": [-0.4, -0.3, 0.0], "color": "#55ff55" } },

    { "meta": { "uuid": "F1" }, "appearance": { "position": [20.0, 0.0, 0.0], "color": "#ff5555" } },
    { "meta": { "uuid": "F2" }, "appearance": { "position": [21.0, 0.5, -0.5], "color": "#ff5555" } },
    { "meta": { "uuid": "F3" }, "appearance": { "position": [19.5, -1.0, 1.0], "color": "#ff5555" } }
  ],
  "aux": [],
  "document_meta": {
    "document_uuid": "00000000-0000-0000-0000-000000000003",
    "schema_uri": "https://q2t-project.github.io/3dsl/schemas/3DSS.schema.json#v1.0.1",
    "author": "dev",
    "version": "1.0.1"
  }
}
